mysql> #UC1:Create database AddressBook service.
mysql> create database addressbook_service;
Query OK, 1 row affected (0.20 sec)

mysql> show databases;
+---------------------+
| Database            |
+---------------------+
| addressbook_service |
| information_schema  |
| mysql               |
| payroll_service     |
| performance_schema  |
| sys                 |
| testdb              |
+---------------------+
7 rows in set (0.07 sec)

mysql> #UC2:Create addressbook table.
mysql> create table addressbook
    -> (
    -> id INT unsigned NOT NULL AUTO_INCREMENT PRIMARY KEY,
    -> FirstName VARCHAR(50) NOT NULL,
    -> LastName VARCHAR(50) NOT NULL,
    -> Address VARCHAR(150) NOT NULL,
    -> City VARCHAR(50) NOT NULL,
    -> State VARCHAR(50) NOT NULL,
    -> Zip VARCHAR(10) NOT NULL,
    -> PhoneNumber VARCHAR(10) NOT NULL,
    -> Email VARCHAR(200) NOT NULL
    -> );
Query OK, 0 rows affected (2.44 sec)
mysql> describe addressbook;
+-------------+--------------+------+-----+---------+----------------+
| Field       | Type         | Null | Key | Default | Extra          |
+-------------+--------------+------+-----+---------+----------------+
| id          | int unsigned | NO   | PRI | NULL    | auto_increment |
| FirstName   | varchar(50)  | NO   |     | NULL    |                |
| LastName    | varchar(50)  | NO   |     | NULL    |                |
| Address     | varchar(150) | NO   |     | NULL    |                |
| City        | varchar(50)  | NO   |     | NULL    |                |
| State       | varchar(50)  | NO   |     | NULL    |                |
| Zip         | varchar(10)  | NO   |     | NULL    |                |
| PhoneNumber | varchar(10)  | NO   |     | NULL    |                |
| Email       | varchar(200) | NO   |     | NULL    |                |
+-------------+--------------+------+-----+---------+----------------+
9 rows in set (0.08 sec)

mysql> #UC3:Insert Records in AddressBook table.

mysql> INSERT INTO addressbook VALUES('Neha','Deshpande','Shanti Nagar,Thane','Thane','Maharashtra','456789',8974561245,'nehadeshpande12@yahoo.com'),
    -> ('Kranti','Kadam','Mulund/Mumbai','Mumbai','Maharashtra','456304',9974561245,'kranti1993@gmail.com'),
    -> ('Monali','Yadav','17-2-589, Saidabad','Hyderabad','Andhra Pradesh','500059',9977654245,'monayadav93@outlook.com'),
    -> ('Hetal','Thakkar',' B/6 Vraj Complex','Vadodara','Gujarat','39007',7577654245,'hetalthakker@gmail.com'),
    -> ('Varnika','Shetty',' 162,seppingsrdblr-1','Banglore','Karnataka','560001',8477654245,'varnikashetty34@gmail.com');
Query OK, 5 rows affected (0.07 sec)
Records: 5  Duplicates: 0  Warnings: 0

mysql> select * from addressbook;
+-----------+-----------+----------------------+-----------+----------------+--------+-------------+---------------------------+
| FirstName | LastName  | Address              | City      | State          | Zip    | PhoneNumber | Email                     |
+-----------+-----------+----------------------+-----------+----------------+--------+-------------+---------------------------+
| Neha      | Deshpande | Shanti Nagar,Thane   | Thane     | Maharashtra    | 456789 | 8974561245  | nehadeshpande12@yahoo.com |
| Kranti    | Kadam     | Mulund/Mumbai        | Mumbai    | Maharashtra    | 456304 | 9974561245  | kranti1993@gmail.com      |
| Monali    | Yadav     | 17-2-589, Saidabad   | Hyderabad | Andhra Pradesh | 500059 | 9977654245  | monayadav93@outlook.com   |
| Hetal     | Thakkar   |  B/6 Vraj Complex    | Vadodara  | Gujarat        | 39007  | 7577654245  | hetalthakker@gmail.com    |
| Varnika   | Shetty    |  162,seppingsrdblr-1 | Banglore  | Karnataka      | 560001 | 8477654245  | varnikashetty34@gmail.com |
+-----------+-----------+----------------------+-----------+----------------+--------+-------------+---------------------------+
5 rows in set (0.00 sec)

mysql> #UC4:Edit Person records using their name.
mysql> update addressbook set Address ='Saidabad' where FirstName ='Monali';
Query OK, 1 row affected (0.15 sec)
Rows matched: 1  Changed: 1  Warnings: 0

mysql> select * from addressbook;
+-----------+-----------+----------------------+-----------+----------------+--------+-------------+---------------------------+
| FirstName | LastName  | Address              | City      | State          | Zip    | PhoneNumber | Email                     |
+-----------+-----------+----------------------+-----------+----------------+--------+-------------+---------------------------+
| Neha      | Deshpande | Shanti Nagar,Thane   | Thane     | Maharashtra    | 456789 | 8974561245  | nehadeshpande12@yahoo.com |
| Kranti    | Kadam     | Mulund/Mumbai        | Mumbai    | Maharashtra    | 456304 | 9974561245  | kranti1993@gmail.com      |
| Monali    | Yadav     | Saidabad             | Hyderabad | Andhra Pradesh | 500059 | 9977654245  | monayadav93@outlook.com   |
| Hetal     | Thakkar   |  B/6 Vraj Complex    | Vadodara  | Gujarat        | 39007  | 7577654245  | hetalthakker@gmail.com    |
| Varnika   | Shetty    |  162,seppingsrdblr-1 | Banglore  | Karnataka      | 560001 | 8477654245  | varnikashetty34@gmail.com |
+-----------+-----------+----------------------+-----------+----------------+--------+-------------+---------------------------+
5 rows in set (0.07 sec)
