mysql> #UC1:Create database AddressBook service.
mysql> create database addressbook_service;
Query OK, 1 row affected (0.20 sec)

mysql> show databases;
+---------------------+
| Database            |
+---------------------+
| addressbook_service |
| information_schema  |
| mysql               |
| payroll_service     |
| performance_schema  |
| sys                 |
| testdb              |
+---------------------+
7 rows in set (0.07 sec)

mysql> #UC2:Create addressbook table.
mysql> create table addressbook
    -> (
    -> id INT unsigned NOT NULL AUTO_INCREMENT PRIMARY KEY,
    -> FirstName VARCHAR(50) NOT NULL,
    -> LastName VARCHAR(50) NOT NULL,
    -> Address VARCHAR(150) NOT NULL,
    -> City VARCHAR(50) NOT NULL,
    -> State VARCHAR(50) NOT NULL,
    -> Zip VARCHAR(10) NOT NULL,
    -> PhoneNumber VARCHAR(10) NOT NULL,
    -> Email VARCHAR(200) NOT NULL
    -> );
Query OK, 0 rows affected (2.44 sec)
mysql> describe addressbook;
+-------------+--------------+------+-----+---------+----------------+
| Field       | Type         | Null | Key | Default | Extra          |
+-------------+--------------+------+-----+---------+----------------+
| id          | int unsigned | NO   | PRI | NULL    | auto_increment |
| FirstName   | varchar(50)  | NO   |     | NULL    |                |
| LastName    | varchar(50)  | NO   |     | NULL    |                |
| Address     | varchar(150) | NO   |     | NULL    |                |
| City        | varchar(50)  | NO   |     | NULL    |                |
| State       | varchar(50)  | NO   |     | NULL    |                |
| Zip         | varchar(10)  | NO   |     | NULL    |                |
| PhoneNumber | varchar(10)  | NO   |     | NULL    |                |
| Email       | varchar(200) | NO   |     | NULL    |                |
+-------------+--------------+------+-----+---------+----------------+
9 rows in set (0.08 sec)

mysql> #UC3:Insert Records in AddressBook table.

mysql> INSERT INTO addressbook VALUES('Neha','Deshpande','Shanti Nagar,Thane','Thane','Maharashtra','456789',8974561245,'nehadeshpande12@yahoo.com'),
    -> ('Kranti','Kadam','Mulund/Mumbai','Mumbai','Maharashtra','456304',9974561245,'kranti1993@gmail.com'),
    -> ('Monali','Yadav','17-2-589, Saidabad','Hyderabad','Andhra Pradesh','500059',9977654245,'monayadav93@outlook.com'),
    -> ('Hetal','Thakkar',' B/6 Vraj Complex','Vadodara','Gujarat','39007',7577654245,'hetalthakker@gmail.com'),
    -> ('Varnika','Shetty',' 162,seppingsrdblr-1','Banglore','Karnataka','560001',8477654245,'varnikashetty34@gmail.com');
Query OK, 5 rows affected (0.07 sec)
Records: 5  Duplicates: 0  Warnings: 0

mysql> select * from addressbook;
+-----------+-----------+----------------------+-----------+----------------+--------+-------------+---------------------------+
| FirstName | LastName  | Address              | City      | State          | Zip    | PhoneNumber | Email                     |
+-----------+-----------+----------------------+-----------+----------------+--------+-------------+---------------------------+
| Neha      | Deshpande | Shanti Nagar,Thane   | Thane     | Maharashtra    | 456789 | 8974561245  | nehadeshpande12@yahoo.com |
| Kranti    | Kadam     | Mulund/Mumbai        | Mumbai    | Maharashtra    | 456304 | 9974561245  | kranti1993@gmail.com      |
| Monali    | Yadav     | 17-2-589, Saidabad   | Hyderabad | Andhra Pradesh | 500059 | 9977654245  | monayadav93@outlook.com   |
| Hetal     | Thakkar   |  B/6 Vraj Complex    | Vadodara  | Gujarat        | 39007  | 7577654245  | hetalthakker@gmail.com    |
| Varnika   | Shetty    |  162,seppingsrdblr-1 | Banglore  | Karnataka      | 560001 | 8477654245  | varnikashetty34@gmail.com |
+-----------+-----------+----------------------+-----------+----------------+--------+-------------+---------------------------+
5 rows in set (0.00 sec)

mysql> #UC4:Edit Person records using their name.
mysql> update addressbook set Address ='Saidabad' where FirstName ='Monali';
Query OK, 1 row affected (0.15 sec)
Rows matched: 1  Changed: 1  Warnings: 0

mysql> select * from addressbook;
+-----------+-----------+----------------------+-----------+----------------+--------+-------------+---------------------------+
| FirstName | LastName  | Address              | City      | State          | Zip    | PhoneNumber | Email                     |
+-----------+-----------+----------------------+-----------+----------------+--------+-------------+---------------------------+
| Neha      | Deshpande | Shanti Nagar,Thane   | Thane     | Maharashtra    | 456789 | 8974561245  | nehadeshpande12@yahoo.com |
| Kranti    | Kadam     | Mulund/Mumbai        | Mumbai    | Maharashtra    | 456304 | 9974561245  | kranti1993@gmail.com      |
| Monali    | Yadav     | Saidabad             | Hyderabad | Andhra Pradesh | 500059 | 9977654245  | monayadav93@outlook.com   |
| Hetal     | Thakkar   |  B/6 Vraj Complex    | Vadodara  | Gujarat        | 39007  | 7577654245  | hetalthakker@gmail.com    |
| Varnika   | Shetty    |  162,seppingsrdblr-1 | Banglore  | Karnataka      | 560001 | 8477654245  | varnikashetty34@gmail.com |
+-----------+-----------+----------------------+-----------+----------------+--------+-------------+---------------------------+
5 rows in set (0.07 sec)
mysql> UC5:Delete recods from table using their name.
mysql> delete  from addressbook where FirstName = 'Kranti';
Query OK, 1 row affected (0.13 sec)

mysql> select * from addressbook;
+-----------+-----------+----------------------+-----------+----------------+--------+-------------+---------------------------+
| FirstName | LastName  | Address              | City      | State          | Zip    | PhoneNumber | Email                     |
+-----------+-----------+----------------------+-----------+----------------+--------+-------------+---------------------------+
| Neha      | Deshpande | Shanti Nagar,Thane   | Thane     | Maharashtra    | 456789 | 8974561245  | nehadeshpande12@yahoo.com |
| Monali    | Yadav     | Saidabad             | Hyderabad | Andhra Pradesh | 500059 | 9977654245  | monayadav93@outlook.com   |
| Hetal     | Thakkar   |  B/6 Vraj Complex    | Vadodara  | Gujarat        | 39007  | 7577654245  | hetalthakker@gmail.com    |
| Varnika   | Shetty    |  162,seppingsrdblr-1 | Banglore  | Karnataka      | 560001 | 8477654245  | varnikashetty34@gmail.com |
+-----------+-----------+----------------------+-----------+----------------+--------+-------------+---------------------------+
4 rows in set (0.16 sec)

mysql> #UC6:Retrive records belonging to city or state in addressbook.
mysql> select  * from addressbook where city ='Thane' or state ='maharashtra';
+-----------+-----------+--------------------+-------+-------------+--------+-------------+---------------------------+
| FirstName | LastName  | Address            | City  | State       | Zip    | PhoneNumber | Email                     |
+-----------+-----------+--------------------+-------+-------------+--------+-------------+---------------------------+
| Neha      | Deshpande | Shanti Nagar,Thane | Thane | Maharashtra | 456789 | 8974561245  | nehadeshpande12@yahoo.com |
+-----------+-----------+--------------------+-------+-------------+--------+-------------+---------------------------+
1 row in set (0.00 sec)
mysql> #UC7:Return size(count) of addressbook by state and city.
mysql> select state ,count(state) from addressbook Group By state;
+----------------+--------------+
| state          | count(state) |
+----------------+--------------+
| Maharashtra    |            1 |
| Andhra Pradesh |            1 |
| Gujarat        |            1 |
| Karnataka      |            1 |
+----------------+--------------+
4 rows in set (0.00 sec)

mysql> select city ,count(city) from addressbook Group By city;
+-----------+-------------+
| city      | count(city) |
+-----------+-------------+
| Thane     |           1 |
| Hyderabad |           1 |
| Vadodara  |           1 |
| Banglore  |           1 |
+-----------+-------------+
4 rows in set (0.00 s
mysql> #UC8:Retrieve entries sorted alphabetically by name  for given city.
mysql> select * from addressbook where city = 'Thane' ORDER BY FirstName;
+-----------+-----------+--------------------+-------+-------------+--------+-------------+---------------------------+
| FirstName | LastName  | Address            | City  | State       | Zip    | PhoneNumber | Email                     |
+-----------+-----------+--------------------+-------+-------------+--------+-------------+---------------------------+
| Neha      | Deshpande | Shanti Nagar,Thane | Thane | Maharashtra | 456789 | 8974561245  | nehadeshpande12@yahoo.com |
| Shravani  | More      | Ram Nagar,Thane    | Thane | Maharashtra | 456789 | 8974561245  | shravanimore31@yahoo.com  |
+-----------+-----------+--------------------+-------+-------------+--------+-------------+---------------------------+
2 rows in set (0.06 sec)

mysql> #UC9:Ability to indentify each AddressBook with name and Type.
mysql> update addressbook set type ='AddressBook1' where  FirstName ='Neha' or FirstName ='Varnika';
Query OK, 2 rows affected (0.17 sec)
Rows matched: 2  Changed: 2  Warnings: 0

mysql> update addressbook set type ='AddressBook2' where  FirstName ='Monali' or FirstName ='Shravani';
Query OK, 2 rows affected (0.06 sec)
Rows matched: 2  Changed: 2  Warnings: 0

mysql> update addressbook set type ='AddressBook3' where  FirstName ='Hetal';
Query OK, 1 row affected (0.23 sec)
Rows matched: 1  Changed: 1  Warnings: 0

mysql> update addressbook set type ='Family' where  FirstName ='Monali' or FirstName ='Shravani';
Query OK, 2 rows affected (0.35 sec)
Rows matched: 2  Changed: 2  Warnings: 0

mysql> update addressbook set type ='Friends' where  FirstName ='Neha' or FirstName ='Varnika';
Query OK, 2 rows affected (0.10 sec)
Rows matched: 2  Changed: 2  Warnings: 0

mysql> update addressbook set type ='Profession' where  FirstName ='Hetal';
Query OK, 1 row affected (0.05 sec)
Rows matched: 1  Changed: 1  Warnings: 0

mysql> select * from addressbook;
+-----------+-----------+--------------+------------+----------------------+-----------+----------------+--------+-------------+---------------------------+
| FirstName | LastName  | addressBook  | type       | Address              | City      | State          | Zip    | PhoneNumber | Email                     |
+-----------+-----------+--------------+------------+----------------------+-----------+----------------+--------+-------------+---------------------------+
| Neha      | Deshpande | AddressBook1 | Friends    | Shanti Nagar,Thane   | Thane     | Maharashtra    | 456789 | 8974561245  | nehadeshpande12@yahoo.com |
| Monali    | Yadav     | AddressBook2 | Family     | Saidabad             | Hyderabad | Andhra Pradesh | 500059 | 9977654245  | monayadav93@outlook.com   |
| Hetal     | Thakkar   | AddressBook3 | Profession |  B/6 Vraj Complex    | Vadodara  | Gujarat        | 39007  | 7577654245  | hetalthakker@gmail.com    |
| Varnika   | Shetty    | AddressBook1 | Friends    |  162,seppingsrdblr-1 | Banglore  | Karnataka      | 560001 | 8477654245  | varnikashetty34@gmail.com |
| Shravani  | More      | AddressBook2 | Family     | Ram Nagar,Thane      | Thane     | Maharashtra    | 456789 | 8974561245  | shravanimore31@yahoo.com  |
+-----------+-----------+--------------+------------+----------------------+-----------+----------------+--------+-------------+---------------------------+
5 rows in set (0.02 sec)
